,doc_no,dominant_topic,topic_perc_contrib,keywords,text
96,129,3.0,0.9700000286102295,"result, health, inform, week, wait, instruct, test, price, help, follow","I bought this for my father, and itâ€™s been â€˜analyzingâ€™ since NOVEMBER! The status hasnâ€™t changed! Tomorrow itâ€™s March! Iâ€™ve emailed them and all they do is apologize...I put in specific instructions for them to call me...nothing. This is the most horrible company. I went to AncestryDNA and already got the results for mine! How can something be analyzing for 3+months? Save your money, donâ€™t waste your time. I genuinely have NO idea how people on here gave it such high ratings."
97,1869,3.0,0.9700000286102295,"result, health, inform, week, wait, instruct, test, price, help, follow","I was pretty nervous from reading the other reviews but I had a great experience! I ordered on Black Friday and recieved the kit Sunday afternoon. I followed the instructions and sent the kit to the lab that Tuesday.

It only took 9 total days from that Tuesday to get my full ancestry and health. I was pretty shocked it was so quick because the one I did with Ancestry.com took 4 weeks.

I love the app and the fact that you can track your package all the way to the lab, then it checks off each task as it’s finished until your results are in.

This is a great gift!"
98,862,2.0,0.9700000286102295,"test, result, inform, breast_cancer, famili, diet, health, cancer, genet, process","I bought this on black friday. Any other day it would have been too expensive for me. I got the results back a bit early, but was dissapointed with the results. Allow me to explain, I bought this because I thought it could give me detailed informtaion on my ethnicity. It just said, ""Middle Eastern"". I was aware I was Middle Eastern, but I wanted more specific countires rather than a genral area. My friend is Japanese and it said specifically Japanese, not just ""East Asian"". Can you see why I'm dissapointed?"
99,1158,3.0,0.9700000286102295,"result, health, inform, week, wait, instruct, test, price, help, follow","I did both the health and the ancestry dna thru 23andme, I have found it very helpful in finding family that I never knew I had .... I was able to track back 23 generations using dna. The health screen has been an asset, some things I knew some I didn't so that helps my children and grandchildren .... So I would recommend it as a tool to help you in your journey. My only advice, if you and siblings do this together, if your parents are living .....ask them if there is anything that may come up ..... dna doesn't lie. So if there are any secrets that have been kept for years they may come out! As my brother and I found out. We are in our 50s and our Mother was a very good secret keeper!"
