,doc_no,dominant_topic,topic_perc_contrib,keywords,text
0,1845,4.0,0.9929999709129333,"result, test, health, custom_servic, inform, wait, week, report, product, servic","The DNA test itself is fine and useful IF you are looking for DNA relatives or you buy and upload results to promethease.com, which will tell you everything that is published on SNPedia about your genes and is only $5.00; BUT the company 23andme is a mess! Their website is a mess!
In the first place, they don't really distinguish, when setting up your account, which questions are required to set up your account and which are voluntary to help them with research. That is frustrating. A person should be able to tend to the important agreements and know they're done with those and that their account is set up before being asked what probably amounts to (not exaggerating) 10-15 hours of health questions.
In any case, realizing that somehow I'd gotten onto that treadmill and it wasn't going to end, I tried over the course of 3 days and put over 8 hours into attempting resolve a website glitch that would allow a person to choose whether they did or didn't want their sample stored for further research.

I had friends over to see if they could figure out the problem. I called and wrote to customer service.- two different branches of the company - and they didn't seem to care. Their customer service is the worst! They just refer you to their website! By the time my sample had arrived at the company, it was too late to change anything (although I did spend another 2 hours trying to do so!)

So, basically, if you're having trouble with the website, they say: Go to the website!

Specifically, I'd say, ""Hey, I'm having trouble with this link. It's not taking me to the page where I can choose to have my sample stored! My friends have come over to see if I'm an idiot or what the problem is, we've spent hours and hours trying to solve this... Here's the browser I'm using, blah, blah..."" and probably no less than 15 times, I was referred to the link that wasn't working, or a different one that linked to it and then asked to rate their customer service!""

It was infuriating!

I've ordered this for myself and two other members of my family - I ordered theirs first as gifts - so I was obligated to use 23andMe but they're are just really bad at the business end; which is probably typical for a company run by scientists."
1,1808,4.0,0.9900000095367432,"result, test, health, custom_servic, inform, wait, week, report, product, servic","Timelines are a little wonky. I sent mine in and it was received December 7th. My husbands was received December 8th. His results came in on around January 15th. I still not have received mine though it is, just barely, still within the timeline of 6-8 weeks.

That said, I've viewed the results for my husband and it's very interesting to look through. I think we knew what we were going to see and weren't surprised to get the results he did. The predisposition to diseases was at least an interesting read, though they stress that environment and other factors play a big role in your chances of actually acquiring any of the mentioned diseases/disorders.

UPDATE: On the first day over 8 weeks, I sent an email to customer support saying that I hadn't seen any progress from essentially step 2 after they receive it and just wanted an update. I received a very courteous response saying that they were moving my sample to the front and that I would be receiving a free code for another kit! I received my results on Feb 14th - almost 10 weeks later. I definitely expected a little delay since I sent in around the holidays and really wasn't in any hurry since the data wasn't going to change, just very curious. I appreciate the fantastic customer service. I've read that people are very frustrated with them when they email before the 8 weeks demanding updates, but that is what the slider on the homepage is for - to provide updates. If it gets past 8 weeks, then ask what's up."
2,880,2.0,0.9890000224113464,"test, result, inform, breast_cancer, famili, diet, health, cancer, genet, process","What a wonderful product. It is so easy to do, you just spit into a tube, fill it to a line, cap it, then send it off! My results came back in about seven weeks, and was surprisingly very accurate. It seems that the more diverse your ancestral profile is, the less satisfaction you'll have with it. Mine was straight 50/50, so there was no ambiguity about it. The results are further broken down into specific global regions of your ancestry origins. I found it to be extremely helpful. The traits, diseases and other information was also straightforward and easy to read. It's a quality kit with fantastic information. I've had suspicions about my ancestral origins, and the results proved them correct. What I really liked was the results pinpointed on a time line, specific years of ancestry, so you can plot migration patterns. Mine went back to the 1700's Native Americans, then migrated out to Eastern Asia around 1800. It mentioned my 3rd or 4th grandfather was most likely from a specific region of a specific country, and the approximate years he was alive. Very cool! BUY IT. I consider myself lucky to be living in a time where such technology is available and affordable."
3,1795,4.0,0.9890000224113464,"result, test, health, custom_servic, inform, wait, week, report, product, servic","For my white partner, the results are so detailed - X% welsh, Y%english, Z% scottish, catalan, french, Italian sardinian(?) etc etc. He had so much detailed description of where his ancestry is from. 23andme has Sardinian(?) in their results (unbelievable) but you categorize an entire population as South Asian. For me, I got 99.9% South Asian. Are you kidding me? I could have said that without a $200 DNA test. For a population of over 1.3 billion people in India alone, 23andme can't find a proper DNA analysis for this population? Are they THAT lazy? For British Isles, or other small islands in Europe they could provide a detailed analysis of it including tiny regions.

I did a Genographic Project DNA test two years ago and that was more detailed that 23andme's terrible DNA result. 40% South East Asian, 30% South West Asian, 14% Mediterranean, 4% Northern European among others. Not only that, I was 2% Neanderthal and 3% Denisovan.

None of these results were on 23andme. Just 99.9% South Asian. I could have looked in the mirror to know that.

Sorry about my language, but that's what it is. A LAZY DNA test. Such a waste of my money and time.

I will not recommend 23andme to anybody. It's so White Anglo Saxon centric. 23andme should invest some more money for research of different population samples before going around advertising their product further."
4,1374,4.0,0.9879999756813049,"result, test, health, custom_servic, inform, wait, week, report, product, servic","Firstly, I paid the higher price to have the health screening done, it took me months to decide if I wanted this due to having family medical conditions. When I got my results back there is no medical history and they said that I did not pay for this. But they are happy to give me the results if I pay $120 more...

I also do not trust my results at all. There results that are coming up are showing me only one last name ( out of 977 results) that is familiar on my list of relatives. It’s Clark. It doesn’t show that I have any Native American or Scottish ancestry even though my mom is atleast 80% Scottish.

It took three weeks to get the test back (end of June) when I was expecting it in August. I called the help line and it goes straight to a man in India that barely could understand me and said there is no way any mistakes could be made. He yelled this at me after I questioned him.

I mostly took this test to get the health results. I know my family and I know up to third cousins on almost all the branches. I’m German Scottish English and Irish With a pinch of Native American. I am going to keep emailing until someone can help me. I hope others don’t go through this."
5,1480,3.0,0.9879999756813049,"result, health, inform, week, wait, instruct, test, price, help, follow","So I bought this on the Amazon Prime day special. Instructions were easy enough, (Need more spit that you would think... lol) Registration is a bit involved but thorough and easy enough. Now here is where it gets a bit crappy. 23andme outsources the testing to LabCorp (for multiple and legit reasons that is actually beneficial to you the customer) though they had some security issues that required some down time which meant some holdups on processing, some redirecting of packages to another lab, etc... though they are horrible about communicating these delays and just give you cookie cutter responses instead of an honest explanation as to what is going on. If you ever need to call them you get outsourced call service which I honestly did not even waste my time with and automatically asked for someone in the states. Luckily my sample only ran in to two delays, both of which were fixed within about a week each so not as horrible as some other people. Do expect this to take the full 6-8 weeks they ask for though you might get lucky and get it in 4. They do seem to have resolved their issues though and are catching back up so this may no longer be an issue. Do I still recommend this? Yes if you have patience and time to let the sample run its course how ever long it takes. The results are awesome. If you need quick turn around time though I hear ancestry.com DNA is significantly faster."
6,1781,1.0,0.9879999756813049,"report, inform, test, health, genet, result, famili_member, provid, famili, supplement","This DNA test from 23andMe gives you a huge amount of raw data. If you're looking for medical information (not just ancestry), you are getting your money's worth. However, due to FDA regulations, they aren't allowed to interpret it for you beyond some very basic (and frankly unhelpful) reports. This is true for all DNA testing companies when it comes to medical information. The good news is that you can upload your 23andMe data to other websites and receive detailed reports. Promethease.com gives you detailed reporting for just $5 - everything from vulnerabilities to diseases, to genes associated with personality traits. Another commenter mentioned the MTHFR mutations, which are associated with many chronic illnesses. Geneticgenie.org will run your 23andMe results specifically related to these genes, and the report is free. And if you can afford it, the best way to interpret your results is to make an appointment with a genetic counselor, who you can find through NSGC.org. So, you're paying for the data with this test, and it's just a few extra steps to understand the data."
7,1,2.0,0.9869999885559082,"test, result, inform, breast_cancer, famili, diet, health, cancer, genet, process","A family history story indicates that from 1790 to 1815 the Ashburn family line fought Cherokees (Chicamauga). Martin Ashburn was an Ensign in the Knox Regiment of volunteers that destroyed the Chicamaugas in the Fall of 1794. Group of 500 men pursued a group of renegades that had  murdered settlers along the Holston and French Broad Rivers after receiving from George Washington ~ $5,000 under a treaty agreement. The Group elected James Ore the commander who was Martin A.â€™s brother-in-law. president Washington wanted only the miscreants punished. group arrived near present day Chattanooga on the North side of the Tennessee River and were about to return home empty handed when a white captive living with the Chicamaugas for seven years (16yrs old) offered to help the Group engage the Indians by surprise. Cherokees sued for peace. never again attacked settlers as as tribe. The battle was remembered as the Running Waters, Cave and Lookout mountain campaign.
Martin settled in the Sequatchie Valley in 1815. Hid grandson and namesake married a full blood Cherokee woman named Mary Hawkins in 1841 and moved on to former Indian Land near Lookout Mountain in Alabama. Martin and Mary had many children. among them my grandfather William Lafayette Ashburn. By Don Ashburn 2019."
8,1742,2.0,0.9869999885559082,"test, result, inform, breast_cancer, famili, diet, health, cancer, genet, process","5 stars based on gender accuracy. It's a girl! And sure enough my genetic blood testing confirmed.

4 stars for the blood collection process.

Improvements would include instructions outside of the box so you can read what the process entails prior to collection. Even if they are printed on the box still sealed.

My biggest issue was the collection vial didn't have a distinct edge/lip where u can scrape the blood off your finger. Mine took 3 pricks before I got good blood flow and by then it was sticky and clotting. I couldn't scrape the blood into the vial bc there was was a thin blood bubble blocking it and blood was running everywhere but into the collection vial. It was a total mess bc of this. However, maybe had I done the prick on the outside of my ring finger first it would have gone a lot smoother and avoiding this issue entirely.

Overall, I would purchase again since the results were accurate in my case.

Tip: With my experience my ring finger, on the side by my pinky in the fatty part, was the best place to prick.

Good Luck."
9,1774,4.0,0.9869999885559082,"result, test, health, custom_servic, inform, wait, week, report, product, servic","A waste of money. Very vague results, difficult to contact them. A very small data base. My wife is 31% Cherokee Indian, they identified her as 0.0%. Please read the many negative reviews on this outfit across the net. The FDA chose to shut down part of their operation. I should have done the homework before wasting money on 3 kits.

I did make contact with them about my wife's inaccurate Native American results and they said her Native American DNA could be washed out in as little as 3 generations back from her and not show up on her results. My DNA results stated that I was 0.1% Native American, news to me. How can they find you are .6% Iberian but miss 31% Native American raises doubts on the validity of their small data base and at best their speculative results."
10,1119,2.0,0.9869999885559082,"test, result, inform, breast_cancer, famili, diet, health, cancer, genet, process","What a waste of money! First you are prompted to answer a bunch of questions regarding your family medical history, which I did. Then you are prompted to answer a bunch of other questions what are then ""determined"" when you get your test results. ""Surprisingly"", my DNA results indicated that I didn't have the markers for any of the diseases that I marked as negative when I filled out my questionnaire. Your ancestry will then be grouped so broadly that it won't answer any of your questions. I'm ""European""? Not a big surprise. I'm also"" British and Irish"", which they grouped together. I wanted a test that would break the results down specifically. ALSO the test results were completely OPPOSITE of the results from the National Geographic DNA test, which broke everything down. I got MUCH, MUCH, MUCH more information from the National Geographic DNA test which breaks down the routes your ancestors took then this 23 and ME test which basically parroted back the info that I answered on the initial questionnaire. If you have an extra $200.00 to blow, donate to some charity."
11,1185,4.0,0.9869999885559082,"result, test, health, custom_servic, inform, wait, week, report, product, servic","I am very disappointed with 23 and Me. I have tested with other companies prior to purchasing the 23and Me DNA Test - Health + Ancestry. I had good results from the other DNA tests but I wanted to test with 23and Me for the Health reports. I purchased my kit on 11/24/17 and received the test kit on 11/29/17. The kit was received at their lab on 12/6/2017. On 2/18/18 I received an email stating “our laboratory attempted analysis of your saliva sample but the concentration of DNA was insufficient to produce genotyping results”. They sent a replacement kit on 2/20/2018. They received my second saliva sample in their lab on 03/01/2018. I did this time reach out to their Customer Service Department a few times regarding the status of my test as I was not feeling too confident in them at this point. As suspected, I received an email on 4/2/2018 stating “They could not successfully analyze the second saliva sample for the same reason that produced the first analysis failure, the concentration of DNA in the saliva sample was insufficient.” They would not send another kit but they would refund my money. My frustration with them is that I had sent a saliva sample to another company and they were able to extract my DNA with no problems. I originally never thought of the possibility that the test would fail. I was shocked. I do not recommend the 23andMe DNA Test!"
12,4,3.0,0.9860000014305115,"result, health, inform, week, wait, instruct, test, price, help, follow","It’s an attractive application, but its functionality as far as user autonomy/interaction is low. There is no in-app messaging feature (so connecting/staying connected with DNA relatives is difficult). If you message a relative and they message you back, if the app doesn’t notify you that they responded (and it doesn’t always), you won’t know that person has messaged you unless you circumnavigate the labyrinth of features back to that particular user’s DNA profile. Another one of the biggest failures of this app is that it does not orient based on how you’re holding your mobile device. It only works if you’re holding your mobile device upright. So if you are using a tablet on its side, the app doesn’t adjust to that orientation. Overall, all it really does is passively allow you to absorb colorful information with your mobile device when you’re holding said device in an upright orientation. Don’t expect to be able to interact with the application or actively use any of the information with it."
13,1552,3.0,0.9850000143051147,"result, health, inform, week, wait, instruct, test, price, help, follow","I will tell everyone I know how bad this was. I have a masters degree in healthcare, manage medical clinics, and neither me or the doctors I work with could make any sense of the nonsense they sent me for results. They were completely vague with little usable information. I also ordered a kit for my son-after 16 weeks, they said they could not send me results and blamed the sample! This is NOT rocket science. My son knows how to spit into a tube! I am 95% sure that this happened because my son has a lot of different backgrounds, and they didn't have the database to process the results and then try to blame ""the spit"". Then they were rude, hard to contact, and when I then demanded a refund, they sent me a link to request a refund, but when you click the link it said ""page not found"". Take your chances with this company if you want but you have been warned...."
14,1974,3.0,0.984000027179718,"result, health, inform, week, wait, instruct, test, price, help, follow","WIth a grandmother who died from complications from alzheimers disease, I decided to suck it up and see if I too was at risk. Happily the test put my mind to rest. However, it did bring up one potential problem - macular degeneration. Now that I know, I will keep my eye appointments and eat foods to keep my vision strong. It may be a little scary to see what your DNA holds - but keep in mind, epigenetics tells us DNA is NOT everything - lifestyle is SOOO much more impactful. Think good thoughts, keep stress levels low and eat well - steps I can take to keep bad DNA from expressing itself.

In addition to valuable health information - I learned a lot more about my ancestry. My siblings and I cracked up to learn we have a great deal of Neanderthal blood in us! Oh my - now I know where my family's red hair and light colored eyes come from! LOL"
15,840,1.0,0.984000027179718,"report, inform, test, health, genet, result, famili_member, provid, famili, supplement","Do not spend your money for the Health Analysis, it is a total waste of time. A lot of fluff, but nothing really meaningful form a clinical point of view.

As far as the ethnic ancestry, it grouped my Spain ancestry into meaningless broad categorizes that clearly reflect either their lack of understanding about Spain's unique mix of many distinct ethnic groups or a very small sample data abase; but most likely, a flaw in their algorithm.

When I challenged their answers, they got angry and defensive and simply stopped all communications! Welcome to modern life in which technology frees evyone form being fully accountable.

Telling me that I am mostly Iberian and broadly southern Mediterranean is less than what I already knew. Also, they are not able to report Spanish Moorish DNA at all, and even their Jewish percentages seem questionable.

Not sure it is very useful for Hispanic people."
16,1532,1.0,0.984000027179718,"report, inform, test, health, genet, result, famili_member, provid, famili, supplement","Its fascinating to know where your ancestors were living. I am 100% European and that is almost completely northern European with the largest part from Ireland and Britain. My maternal ancestry goes back to the Caspian Sea area This information has spurred an interest in learning now about the history of my unknown ancestors in the British Isles. Unfortunately the company is not legally allowed to give any information about possible genetic links to illness. Imo that information should be given to us. The company will however automatically update your information if new data becomes available. So if the government will allow it, in the future there may be information made available about possible health issues linked to genetics.

Oh and genetically I am 2.6% neanderthal :)"
17,1796,1.0,0.9829999804496765,"report, inform, test, health, genet, result, famili_member, provid, famili, supplement","I am so disappointed. I bought this based on all the t.v. hype and hey even Ryan Seacrest is a spokesman. If they were wrong about just a couple of things it would have been ok, but that is not the case. Of the twenty something traits the got 10 wrong. As far as my ancestory 2 other tests show 12% Spanish while nothing from the iberian peninsula came up on this. Do I at least trust the health report and carrier status. Nope I have 1 decease they say I am not carrier for. Also, the reports read like a weather report. You have a high percentage of having blue eyes. Mine hazel to the brown gold side. There is a 50% chance it may rain. I think I could have been happier spending this amount of money on an online psychic. At least their shot in the dark analysis couldn't be proven wrong by a mirror and Physical."
18,15,2.0,0.9829999804496765,"test, result, inform, breast_cancer, famili, diet, health, cancer, genet, process","App is bare bones no where near the functionality of the 23andMe website. Design is only really applicable for iPhone. It runs on iPads as an iPhone app. 23andMe should  devote some time to expanding the app to run on iPads and making use of the expansive display real estate the iPad offers. Seems like a lost opportunity. 

Itâ€™s a shame 23andMe has not taken the time to make this app an effective interface to their cutting edge genome technology.

Just got latest update, 4.2.0, still does not support large format of the iPads. Every other major vendor has embraced apples uniform coding standards that allow apps to run cleanly across the a-please iOS family of products. This is an okay app for 2010 but come on 23andMe itâ€™s 2018 we expect more!"
19,873,1.0,0.9819999933242798,"report, inform, test, health, genet, result, famili_member, provid, famili, supplement","Very thorough analysis of regional ancestry and the likelihood of various genetic medical conditions and physical traits. The descriptions for each aspect are concise with reference to a complete explanation and an opportunity to ""meet"" your genetic relatives. Our results closely matched what we knew of our families, but offered a few things we didn't know as well. The end product was both enjoyable and informative. I hope and expect that as more is learned about the genetic markers for aspects not covered in our analysis, that 23 and Me will disseminate this within their customer base."
20,2958,3.0,0.9819999933242798,"result, health, inform, week, wait, instruct, test, price, help, follow","SUPER straightforward. I was worried this would be some strange medical process or take lots of time, but the whole process took ~10 mins from unboxing.

The process is simple: you get a box with a couple of cotton swabs and container. You swab the inside of each cheek for a minute or two, stick the cotton into the provided safe containers, and then mail it back with the box and postage, all provided by vitagene.

Then you wait for your results, which come ~4 weeks later. They cover everything from ancestry to potential health issues.

Overall very satisfied with the process and results. Would recommend for anyone interested in learning a bit more about themselves."
21,824,1.0,0.9810000061988831,"report, inform, test, health, genet, result, famili_member, provid, famili, supplement","23&Me provides you with your ""raw data"" of your genetic SNP's. The raw data they provided me showed that I had the BRCA2 Gene mutation. I was stressed about it for months. I recently went to a genetics counsler and had a blood test to confirm. And I Do NOT have the BRCA2 Gene mutation! It was a false positive from 23&Me. The genetics counseler stated they see a 40% false positive of BRCA2 for the people that come in to have their 23&Me results confirmed. Cost me a lot of money and stress. Wish I never would have taken the 23&Me test!"
